title,description,url
В Госдепе рассказали об эвакуации желающих уехать из Кабула,"    Американские военные эвакуировали по воздуху из Кабула еще две тысячи человек. Как рассказала первый заместитель госсекретаря Уэнди Шерман, за последние несколько дней дипломаты США, находящиеся в столице Афганистана, обработали около пяти тысяч заявок от желающих покинуть страну.   ",https://lenta.ru/news/2021/08/18/evacuation/
В Москве за один час выпала четверть месячной нормы осадков,"    Четверть месячной нормы осадков выпала в Москве за один час. По данным специалистов, в столице выпало 19 миллиметров осадков, что составляет 25 процентов месячной нормы. Кроме того, в некоторых районах города прошел град. При этом порывы ветра достигали 22 метров в секунду, добавили там.<br />  ",https://lenta.ru/news/2021/08/18/msk_dozhd/
Бежавший президент Афганистана рассказал о заговоре против него,"    Президент Афганистана Ашраф Гани, который недавно покинул страну, рассказал о том, что он был проинформирован о заговоре против него. По словам Гани, в прошлое воскресенье, 15 августа, он работал в обычном режиме, однако охранники сообщили ему о готовящемся крупном заговоре.   ",https://lenta.ru/news/2021/08/18/zagovor/
США отказались считать Гани политической фигурой в Афганистане,"    США больше не считают Ашрафа Гани значимой политической фигурой в Афганистане. Об этом заявила первый заместитель американского госсекретаря Уэнди Шерма. «Гани больше не является фигурой в Афганистане», — заявила она. При этом США не потерпят, чтобы правительство превратило Афганистан в «убежище для террористов».  ",https://lenta.ru/news/2021/08/18/gani_usa/
Кличко рассказал о «задании» властей Украины испортить ему репутацию,"    Мэр Киева и председатель Киевской городской государственной администрации (КГГА) Виталий Кличко рассказал, что власти Украины «дали задание» правоохранительным органам испортить ему репутацию. Он назвал обыски, проведенные в коммунальных предприятиях, давлением на власть города и подавлением местного самоуправления.  ",https://lenta.ru/news/2021/08/18/klichko/
Эрдоган заявил о планах провести переговоры с Путиным по Афганистану,"    Президент Турции Реджеп Тайип Эрдоган заявил, что рассчитывает провести переговоры с российским лидером Владимиром Путиным по ситуации в Афганистане в конце недели. Глава Турции также рассказал о планах обсудить данную тему с канцлером Германии Ангелой Меркель в ближайшие дни. <br />  ",https://lenta.ru/news/2021/08/18/peregovori/
Ким Кардашьян заподозрили в потере ягодиц,"    Фанаты заподозрили американскую телезвезду и предпринимательницу Ким Кардашьян в потере объема ягодиц. Лондонский пластический хирург предположил, что она удалила импланты из бедер или перенесла липосакцию. Сама знаменитость пока никак не прокомментировала изменения своей фигуры.  ",https://lenta.ru/news/2021/08/18/lost/
Турция заявила о готовности сотрудничать с талибами,"    Власти Турции готовы к сотрудничеству с «Талибаном» (террористическая организация, запрещенная в России). Соответствующее заявление сделал президент страны Реджеп Тайип Эрдоган.   ",https://lenta.ru/news/2021/08/18/erdogan/
Ласицкене отказались пускать на соревнования в США,"    Олимпийская чемпионка в прыжках в высоту Мария Ласицкене пропустит этап «Бриллиантовой лиги» в США из-за отсутствия визы. Ласицкене отказались пускать на соревнования в Юджине по причине того, что ей не дали въездную визу. Следующим стартом легкоатлетки станет этап в Лозанне, который пройдет 26 августа.   ",https://lenta.ru/news/2021/08/18/maria_viza/
Украинские силовики пришли с очередными обысками к киевским властям,    Украинские правоохранители устроили очередные обыски в Киевской городской государственной администрации (КГГА). На этот раз силовики пришли в городской департамент образования и на местное коммунальное предприятие. Обыски проходят в рамках расследования дела по фактам нецелевого использования бюджетных средств.   ,https://lenta.ru/news/2021/08/18/kiev_obyski/
Путин проведет встречу с лидерами списка «Единой России»,"    Президент России Владимир Путин проведет встречу с представителями партии «Единая Россия» 22 августа. По данным «Коммерсанта», мероприятие будет публичным. Кроме «новых лиц» во встрече примут участие члены федеральной части партийного списка. Также российский лидер также посетит съезд партии 24 августа.  ",https://lenta.ru/news/2021/08/18/vstre4a/
МИД назвал дело Навального «спланированной провокацией» против России,"    Инцидент с делом Алексея Навального <i>(учредителя ФБК, включенного Минюстом в реестр организаций, выполняющих функции иностранного агента, и признанного экстремистской организацией)</i> является спланированной провокацией, направленной на дискредитацию России, заявили в МИД. <br />  ",https://lenta.ru/news/2021/08/18/provokaciya/
Продавец нашел способ отомстить бросившему коллегу мужу,"    Продавец нашел способ отомстить бывшему мужу коллеги, который пришел в магазин с новой девушкой. Он обвинил девушку в том, что она разрушила семью и спит с человеком, который по возрасту годится ей в деды. В ответ пара начала оскорблять продавца, и тогда ему пришлось выгнать покупателей.   ",https://lenta.ru/news/2021/08/18/revenge/
Минюст России признал движение «Голос» иноагентом,"    Министерство юстиции признало общероссийское общественное движение в защиту прав избирателей «Голос» иностранным агентом. Движение было внесено в новый реестр незарегистрированных общественных объединений, которые выполняют функции иностранного агента на территории России.<br />  ",https://lenta.ru/news/2021/08/18/golos_inoagent/
Боевики «Талибана» в Кабуле замазали изображения женщин,"    Боевики террористической группировки «Талибан» стали замазывать женские лица, изображенные на уличных граффити в Кабуле. На кадрах, опубликованных в Twitter, видно, как талибы замазывают белой краской женские лица, изображенные на рекламе возле салона красоты. Талибы оправдывают данные действия нормами ислама.  ",https://lenta.ru/news/2021/08/18/afface/
Крупнейшие компании США обвинили в приближении глобального потепления,"    Американские бизнес-гиганты как прямо, так и косвенно способствуют приближению глобального потепления. Их обещания по борьбе с изменением климата не совпадают с реальными темпами сокращения углеродных выбросов в атмосферу. Эти загрязнения не являются следствием производственной деятельности предприятий.   ",https://lenta.ru/news/2021/08/18/offense/
Мужчина угнал два автомобиля ради примирения со сбежавшей женой и попался,"    Житель Турции хотел помириться с убежавшей в другой город женой. У него не было денег, чтобы добраться до нее, поэтому он решил угнать пикап. Заручившись поддержкой друзей, он угнал пикап. Они продали его на металлолом и прогуляли полученные деньги. Позже они похитили еще один фургон, но вскоре их задержала полиция.<br />  ",https://lenta.ru/news/2021/08/18/theft/
В Китае задумали «зеленый» мегапроект,"    Внутренняя Монголия (автономный район на севере Китая) одобрила масштабный энергетический мегапроект, в котором для производства «зеленого» водорода будет использоваться энергия солнца и ветра, сообщает Bloomberg. Строительство планируется начать в октябре 2021 года, а эксплуатация намечена с середины 2023 года.  ",https://lenta.ru/news/2021/08/18/mega_chi/
Бежавший президент Гани пообещал вернуться в Афганистан,"    Президент Афганистана Ашраф Гани обратился к народу республики. В своем обращении президент подтвердил, что находится в Объединенных Арабских Эмиратах (ОАЭ). Он заявил, что его вынудили покинуть Афганистан. Государственный лидер пообещал вернуться в республику в ближайшем будущем.   ",https://lenta.ru/news/2021/08/18/gani_speaks/
Белорусские журналисты ответили на задержания своих коллег,"    В белорусском информационном агентстве БелаПАН ответили на задержания своих коллег в Минске. Там заявили, что считают случившееся «продолжением политики подавления свободы слова в Белоруссии», и потребовали от властей Белоруссии немедленно освободить «всех находящихся в заключении журналистов».  ",https://lenta.ru/news/2021/08/18/belapan_responce/
Нурмагомедов рассказал об отношении к обещавшему «порвать его» Новому Хабибу,"    Хабиб Нурмагомедов рассказал о своей возможной встрече с бойцом ММА Хамзатом Чимаевым, которого называют Новым Хабибом. Бывший чемпион UFC отметил, что не станет отвечать на слова шведского спортсмена, пообещавшего «порвать его». Нурмагомедов и Чимаев могут встретиться 30 сентября на турнире в Абу-Даби.   ",https://lenta.ru/news/2021/08/18/khabib_new/
Британские пабы оказались на грани закрытия из-за дефицита пива,"    Пабы Великобритании оказались на грани закрытия из-за дефицита пива популярных марок. Исполнительный директор Британской ассоциации пива и пабов Эмма Макларкин указала на нехватку водителей и складского персонала для решения логистических проблем, из-за которых происходят перебои в поставках.  ",https://lenta.ru/news/2021/08/18/pubs/
Датские военные заметили российские подлодки в своих водах,"    Две российские дизель-электрические подводные лодки вместе с кораблем сопровождения прошли через пролив Большой Бельт, который является частью датской акватории. В Копенгагене отметили, что суда на протяжении всего маршрута следовали в надводном положении. Это является предпосылкой для безопасного прохода.   ",https://lenta.ru/news/2021/08/18/denmarkl/
Россиянам раскрыли способы избежать мошенничества при бронировании жилья в Крыму,"    Риелтор Алексей Степанов раскрыл способы, как сэкономить при бронировании жилья в Крыму, а также избежать мошенничества. По словам эксперта, выгодней выбирать отдаленные от побережья районы небольших курортных городов — цены в них ниже на 15-30 процентов, чем в Ялте и Севастополе.<br />  ",https://lenta.ru/news/2021/08/18/crimeahome/
Американских нефтяников заставят заплатить за пожары,"    Две трети опрошенных американцев считают, что нефтяные компании должны взять на себя ответственность за последствия глобального потепления в стране. Сенаторы уже поддержали законопроект, который заставит производителей ископаемого топлива заплатить за масштабные пожары. Средства предлагают вложить в фонд.  ",https://lenta.ru/news/2021/08/18/pay/
Евросоюзу посоветовали впустить больше беженцев из Афганистана,    Странам Евросоюза стоит впустить больше беженцев из Афганистана: отменить принудительную репатриацию нелегальных мигрантов из этой страны и увеличить квоты на их прием. Об этом заявила еврокомиссар по внутренним делам Илва Йоханссон на экстренной видеоконференции министров внутренних дел ЕС.  ,https://lenta.ru/news/2021/08/18/morefugees/
Раскрыты подробности поимки четвертого беглеца из подмосковного ИВС,"    Четвертого сбежавшего из Подмосковного изолятора временного содержания Александра Бунтару задержали в доме, который уже привлекал внимание полицейских. Ранее они наведывались сюда в 2019 году, когда ребенок жившей там семьи из Молдавии получил травму. Розыск пятого беглеца продолжается.  ",https://lenta.ru/news/2021/08/18/ranningman/
Меган Фокс поддержала тренд и надела расстегнутый кардиган на голое тело,"    Американская актриса и фотомодель Меган Фокс вышла в свет в откровенном образе и привлекла внимание папарацци. 35-летняя знаменитость поддержала тренд на обнажающие грудь топы и прошлась по улицам Лос-Анджелесе в расстегнутом кардигане бренда Jacquemus за 410 долларов (30 тысяч рублей), надев его на голое тело.  ",https://lenta.ru/news/2021/08/18/meganfox/
Раскрыта загадка поведения астероида-аполлона,"    Американские астрофизики нашли объяснение странному, «кометному» поведению астероида Фаэтон: выделение паров натрия заставляет его ярче светиться при приближении к Солнцу и выбрасывает с поверхности обломки пород. Это может объяснять и возникновение метеорного потока Геминиды.  ",https://lenta.ru/news/2021/08/18/apollosodium/
Россияне массово захотели получить вид на жительство в Испании,"    В июле 2021 года спрос на получение вида на жительство в Испании увеличился почти на 30 процентов по сравнению с аналогичным периодом 2020-го. О том, что россияне массово захотели переехать в европейскую страну, сообщили эксперты портала Spain-Real.Estate. Аналитическая заметка есть в распоряжении «Ленты.ру».   ",https://lenta.ru/news/2021/08/18/spain_vnzh/
Советник Кадырова объяснил свой комментарий о талибах-красавчиках,"    Советник главы Чечни Рамзана Кадырова по религиозным делам Адам Шахидов объяснил свой комментарий в Instagram, в котором он назвал боевиков движения «Талибан» (запрещено в России) «красавчиками». Шахидов подчеркнул, что его ответ, который ранее сочли удаленным, на самом деле исчез из-за того, что был удален сам вопрос.  ",https://lenta.ru/news/2021/08/18/obyasn/
Tesla нашла союзника в «войне» за Индию,"    Индийское подразделение Volkswagen стало союзником Tesla в «войне» за Индию и поддержало американскую компанию в стремлении противостоять высоким таможенным пошлинам, установленных местными властями. Представители автомобильной компании заявили, что снижение импортных тарифов на электромобили не отразится на бизнесе.   ",https://lenta.ru/news/2021/08/18/ally/
В ВОЗ рассказали о влиянии вакцинации на «дельта»-штамм COVID-19,"    Вакцинация помогает предотвратить тяжелое течение или смерть при заболевании человека «дельта»-штаммом COVID-19, заявила главный научный сотрудник ВОЗ. Ее поддержала другой эксперт организации, которая отметила, что в регионах с высоким процентом заражения «дельта»-вариантом больше страдает невакцинированное население.  ",https://lenta.ru/news/2021/08/18/wozvac/
Мать написала сообщение одноклассницам дочери и была признана героиней,"    Пользовательницу Reddit признали героиней после того, как она забрала телефон у дочери и написала письмо ее одноклассницам-хулиганкам. Откровенное послание нашло отклик у комментаторов. Они похвалили женщину за то, что та попыталась решить проблему дочери. Один из них назвал письмо «совершенно потрясающим».  ",https://lenta.ru/news/2021/08/18/hero/
Крупный западный банк поддержал Китай на фоне репрессий бизнеса,"    Глава крупного финансового конгломерата HSBC Holdings Марк Такер заявил о важности активного сотрудничества с Китаем вопреки эскалации геополитической напряженности и «репрессиям» местного бизнеса. Между Китаем и США на протяжении нескольких лет идет торговая война, что сказывается на мировой экономике.  ",https://lenta.ru/news/2021/08/18/hsbc/
Родители приняли смертельно опасное заболевание сына за обычное недомогание,"    Пятилетний Робби Фрю впал в кому из-за опухоли мозга, которую его родители приняли за обычное недомогание. В январе Фрю плохо себя почувствовал — родители мальчика приняли его состояние за обычное недомогание от усталости или простуды. Однако вскоре ребенок перестал реагировать на происходящее вокруг него.   ",https://lenta.ru/news/2021/08/18/cancer/
