title,description,urlБелорусский банк лишился карт Visa из-за санкций США,"    После санкций США в отношении Белоруссии местному Абсолютбанку пришлось прекратить часть операций с физлицами. В том числе он лишился возможности обслуживать карты Visa и использовать систему Western Union. Остановлены переводы денежных средств в иностранной валюте, кроме российских рублей.  ",https://lenta.ru/news/2021/08/18/absolut/
Запущены бесплатные исторические экскурсии на курорте «Роза Хутор»,"    Бесплатные исторические экскурсии запустили в музее археологии Сочи курорта «Роза Хутор». Квалифицированные гиды проведут для гостей курорта 45-минутную экскурсию, в ходе которой расскажут об интересных исторических фактах, особенностях расположения и архитектуры курорта.  ",https://lenta.ru/news/2021/08/18/rosakhutor/
В Германии раскрыли темы переговоров Путина и Меркель,"    Российский президент Владимир Путин и канцлер Германии Ангела Меркель могут обсудить ситуацию в Афганистане, на Украине и в Белоруссии во время встречи 20 августа. Темы переговоров раскрыл представитель правительства ФРГ Штеффен Зайберт. В ходе визита Меркель также проведет пресс-конференцию.   ",https://lenta.ru/news/2021/08/18/peregovory/
Мошенники нашли способ наживаться на желании школьников заработать,"    Эксперты Роскачества предупредили россиян о новой схеме обмана в социальных сетях. Мошенники выманивают деньги через «игровые боты», которые обещают быстрый и легкий заработок. Специалисты уточнили, что жертвами злоумышленников обычно становятся несовершеннолетние пользователи.  ",https://lenta.ru/news/2021/08/18/obman_detey/
Мать сдавшей в восемь лет ЕГЭ россиянки подтвердила платное поступление в МГУ,"    Мать российской школьницы Алисы Тепляковой, которая сдала Единый государственный экзамен (ЕГЭ) в восемь лет, подтвердила, что девочка будет учиться на факультете психологии Московского государственного университета (МГУ) на платном отделении. Ранее сообщалось, что девочка не поступила на бюджет.   ",https://lenta.ru/news/2021/08/18/platnoe/
Диетолог дала пять помогающих похудеть побыстрее советов,"    Диетолог из Индии Ручика Батра дала пять советов для желающих эффективно сбросить вес во время диеты. Она считает, что любую диету можно сделать намного эффективнее, если придерживаться пяти простых правил, способствующих скорейшему достижению цели и оздоровлению организма.   ",https://lenta.ru/news/2021/08/18/5sovetov/
Талибы взорвали статую своего давнего врага,"    Боевики движения «Талибан» взорвали статую, возведенную в честь полевого командира Абдулы Али Мазари, врага группировки, воевавшего с талибами в 90-е годы. Многие жители Афганистана встретили данное известие с тревогой. Талибы захватили Афганистан 15 августа, когда почти без боя смогли занять столицу страны Кабул.  ",https://lenta.ru/news/2021/08/18/teardownanttalb/
В Тульской области пройдет международный театральный фестиваль «Толстой»,"    В Тульской области, на территории музея-усадьбы «Ясная Поляна», состоится международный театральный фестиваль «Толстой» — он пройдет под открытым небом с 3 по 5 сентября. Зрителям покажут постановки по мотивам произведений русского классика в разных жанрах и форматах — от традиционной драмы до аудиоспектакля.  ",https://lenta.ru/news/2021/08/18/tolstoi_fest/
В Словакии отказались массово принимать беженцев из Афганистана,"    О том, чтобы Словакия массово предоставляла убежище афганским беженцам «не может быть и речи», заявил словацкий вице-премьер. Словакия готова принять десять афганцев, помогавших словацкой армии в Афганистане, возможно, с их семьями. Дальнейшие вопросы по этой теме правительство обсудит на следующей неделе.  ",https://lenta.ru/news/2021/08/18/slovakafgan/
Володин увидел сходство Горбачева и деятелей Временного правительства 1917 года,"    Председатель Государственной думы Вячеслав Володин, вспоминая обстоятельства распада СССР, увидел сходство последнего советского лидера Михаила Горбачева и деятелей Временного правительства, которое пришло к власти после свержения последнего российского императора Николая II.  ",https://lenta.ru/news/2021/08/18/1917_1991/
Китайский конкурент нанес Tesla двойной удар,"    Китайский производитель электромобилей Xpeng запланировал увеличить производственные мощности со ста до двухсот тысяч машин в год на одном из своих ключевых заводов из-за обострившейся конкуренции. В июле было произведено чуть больше восьми тысяч автомобилей, что оказалось месячным рекордом.  ",https://lenta.ru/news/2021/08/18/xpeng/
Украине предсказали два варианта будущего,"    Политический аналитик Александр Кочетков предсказал два негативных варианта будущего для Украины. «Или постепенное обнищание (и сопутствующие ему центробежные процессы), или внезапное разрушение государственности», — заявил он. Чтобы избежать этого, нужно сменить модель власти, считает эксперт.<br />  ",https://lenta.ru/news/2021/08/18/kochetkov/
Число погибших после расстрела мирной демонстрации талибами выросло,"    Как минимум три человека погибли после того, как боевики радикального движения «Талибан» (запрещено в РФ) расстреляли мирных демонстрантов в городе Джелалабад. Источники Reuters подтвердили, что на месте происшествия не менее дюжины пострадавших. О том же говорили источники РИА Новости в городе.    ",https://lenta.ru/news/2021/08/18/3/
Производитель Ил-112В прокомментировал запрет на полет Ил-114,"    Никаких решений в отношении полета на VII Международном военно-техническом форуме «Армия-2021» опытного самолета Ил-114 не принималось. Таким образом в Объединенной авиастроительной корпорации, производителе самолетов Ил-112B и Ил-114, прокомментировали сообщение источника ТАСС о запрете полетов на мероприятии.  ",https://lenta.ru/news/2021/08/18/il114/
Союзники США решили пересмотреть роль Штатов в мире после ухода из Афганистана,"    Союзники и противники Вашингтона захотели пересмотреть роль США в мире после того, как американский президент Джо Байден принял решение вывести войска из Афганистана. Об этом пишет The Washington Post. Так, действия Байдена уже вызвали беспокойство у союзников Вашингтона в Европе.  ",https://lenta.ru/news/2021/08/18/rol/
У берегов Вануату объявили угрозу цунами из-за землетрясения,"    У берегов Вануату в Атлантическом океане произошло землетрясения магнитудой 6,8. Об этом пишет РИА-Новости со ссылкой на Геологическую службу США (USGS). Сообщается, что после землетрясения была объявлена угроза цунами. Уточняется, что землетрясение было зафиксировано в 10.10 по времени UTC (13.10 мск).  ",https://lenta.ru/news/2021/08/18/ocean_zemletresenie/
В Петербурге таксист-нелегал сбил сотрудника комитета по транспорту,"    В Санкт-Петербурге полицейские задержали таксиста-нелегала, который наехал на сотрудника комитета по транспорту. Он регистрировал факт нарушения парковки, сообщили в пресс-службе ведомства. Теперь сотрудники комитета по транспорту будут проходить специальные курсы самообороны.  ",https://lenta.ru/news/2021/08/18/sbil/
Великобританию призвали избавиться от опасных кораблей,"    Власти Великобритании призвали взять на контроль сокращение числа опасных для природы кораблей стареющего рыболовного флота страны. Согласно отчету экологов, возраст около половины британских рыболовных судов составляет не менее 30 лет, а их двигатели выбрасывают углерод. Кроме того, корабли вредят мазутом.   ",https://lenta.ru/news/2021/08/18/bri_ships/
Дочь и коллеги покойного создателя знаменитого российского ПО начали войну за его наследие,"Как минимум шестью гражданскими и одним уголовным деломоброс конфликт не сумевших договориться коллег умершего два года назад создателязнаменитого коммуникационного сервера CommuniGate Pro и его дочери. По всейвидимости, в России дочь программиста с наследия своего отца сейчас ничего неимеет. Разбирательство о том, кому должны принадлежать права на продаваемую внашей стране версию сервера, неизбежно реанимирует старые вопросы: является ли CommuniGatePro российским продуктом и имеет ли право находиться в Реестре отечественногоПО. ",https://www.cnews.ru/news/top/2021-08-18_za_nasledie_sozdatelya_znamenitogo
Viewsonic представила серию мониторов Colorpro VP56 для профессионалов,Одобренные Pantone,https://www.cnews.ru/news/line/2021-08-18_viewsonic_predstavila_seriyu_monitorov
"Власти придумали принципы работы для «Яндекса», «Авито», AliExpress: защита прав пользователей и никаких двусмысленностей","ФАС представила базовыепринципы взаимодействия участников цифровых рынков. Среди них — открытость инейтральность цифровых платформ, а также обеспечение прав их пользователей. На данный момент принятие принципов, разработанныхФАС, является добровольным. Окончательная версия документа будет подготовлена ксентябрю 2021 г. ",https://www.cnews.ru/news/top/2021-08-18_regulyator_predpishet_platformam
Samsung выпустила смартфон-супербестселлер и дешевый смартфон с огромной батареей. Видео,"Samsung анонсировала смартфоны Galaxy A52s и Galaxy A03s среднего и бюджетного классов соответственно. Релиз первого состоится через две недели, а A03s поступил в продажу, хотя пока только в Индии. Предшественники обоих аппаратов продаются в России, что увеличивает шансы их появления в российской рознице. ",https://www.cnews.ru/news/top/2021-08-18_samsung_zapuskaet_smartfonbestseller
МТС запустила VDI для работы с «тяжелыми» графическими приложениями,"Сервис GPU Worksaces позволяет создавать рабочие места в течение нескольких минут, обладает расширенными возможностями самостоятельного управления и предотвращает утечки данных",https://www.cnews.ru/news/line/2021-08-18_mts_zapustila_vdi_dlya_raboty
Частные клиенты Райффайзенбанка могут открыть счет для ИП полностью онлайн,Расчетно-кассовое обслуживание (РКО) для бизнеса без визита в отделение,https://www.cnews.ru/news/line/2021-08-18_chastnye_klienty_rajffajzenbanka
Клиенты Сбербанка смогут пользоваться платежным счетом в «Сбербанк онлайн» даже без банковской карты,Даже если карта будет заблокирована,https://www.cnews.ru/news/line/2021-08-18_klienty_sberbanka_smogut
Acer представила в России «умный» 4K-проектор H6800BDa,Acer H6800BDa — мультимедийный проектор с невероятным разрешением и отличной производительностью,https://www.cnews.ru/news/line/2021-08-18_acer_predstavila_v_rossii_umnyj
Аналитики IDC: Xiaomi впервые лидирует на российском рынке смартфонов,По итогам квартала,https://www.cnews.ru/news/line/2021-08-18_analitiki_idc_xiaomi_vpervye
Названо условие ликвидации домена Советского Союза,"Корпорация ICANN, координирующая распределение интернет-ресурсов на глобальном уровне, подготовила политику по выводу географических доменов из эксплуатации. Это будет возможно, если соответствующий двухкбуквенный код будет исключен из списка ISO. Таким образом, судьба доменной зоны Советского Союза .SU перекладывается с ICANN на ISO.",https://www.cnews.ru/news/top/2021-08-18_nazvano_uslovie_likvidatsii
Конференция CNews «Облачные технологии 2021» состоится 16 сентября,16 сентября 2021 г. в Москве CNews проведет конференцию «Облачные технологии 2021».,https://www.cnews.ru/news/top/2021-08-18_konferentsiya_cnews_oblachnye
Радикальная цифровизация отменяется. Россияне смогут отказаться от цифрового паспорта и оставить себе бумажный,Минцифры не будет настаивать на обязательной замене бумажных паспортов на пластиковые. Россияне смогут отказаться от перехода на цифровой паспорт и продолжить пользоваться классическим удостоверением личности. Раньше власти предлагали прекратить выпуск и выдачу бумажных паспортов с 2022 г. ,https://www.cnews.ru/news/top/2021-08-18_tsifrovizatsiya_otmenyaetsya
Платформа корпоративных онлайн-закупок «Комус» интегрирована с Prof-IT SRM,Prof-IT SRM ускоряет корпоративные закупки благодаря интеграции с платформой корпоративной онлайн закупки компании «Комус»,https://www.cnews.ru/news/line/2021-08-18_platforma_korporativnyh
«Ростелеком» установил облачное видеонаблюдение на площадках отдыха в Челябинске,"Установленное видеонаблюдение позволит вести мониторинг соблюдения правил поведения на открытых водоемах в летний и зимний периоды, а также обеспечит профилактику нарушений общественной безопасности",https://www.cnews.ru/news/line/2021-08-18_rostelekom_ustanovil_oblachnoe
Спутниковые решения РТКОММ помогли интегрировать спасателей удаленного тувинского поселка в единую региональную диспетчерскую службу,"Скоростным спутниковым интернетом оснащены поселковая пожарная часть, диспетчерский центр и станция скорой помощи",https://www.cnews.ru/news/line/2021-08-18_sputnikovye_resheniya_rtkomm
НТЦ «ИТ Роса» и «Смарт-Софт» подтвердили совместимость своих продуктов,Универсальный шлюз безопасности Traffic Insector Next Generation на платформе ROSA Virtualization,https://www.cnews.ru/news/line/2021-08-18_ntts_it_rosa_i_smartsoft
"Мобильное приложение инвестиционного портала Москвы скачали более 4,5 тысячи раз",В приложении можно следить за московскими новостями в сфере инвестиций,https://www.cnews.ru/news/line/2021-08-18_mobilnoe_prilozhenie_investitsionnogo
Sitronics KT разрабатывает авторулевой «Румб» для управления курсом судна и движения по заданной траектории,"В состав авторулевого входит панель контроля управления, приборы сопряжения с рулевыми машинами или винторулевыми колонками, датчики обратной связи и вычислительный прибор",https://www.cnews.ru/news/line/2021-08-18_sitronics_kt_razrabatyvaet_avtorulevoj
«Лига цифровой экономики» будет внедрять «Платформу управления данными» от «Ростелекома»,"Решение для хранения, обработки и управления корпоративными данными",https://www.cnews.ru/news/line/2021-08-18_liga_tsifrovoj_ekonomiki
"Программисты в России получают в 2,33 раза больше средней зарплаты по стране","Средняя зарплата российского программиста в 2020 г. составила119 тыс. руб. Этот показатель на 133% выше, чем средний доход по стране. Поданным Росстата, в среднем по другим отраслям работники получают 51,1 тыс. руб.Однако проблема дефицита кадров в России стала ощущаться острее, это можетспровоцировать рост зарплат ИТ-специалистов в 2021 г. ",https://www.cnews.ru/news/top/2021-08-18_zarplata_itspetsialista
Власти написали правила для сбора банками и госорганами биометрии граждан,"Минцифры планирует распространить стандарты сбора биометрических слепков лиц и голосов физлиц на коммерческие биометрические системы. Новые правила обязывают собирающие биометрию организации обеспечить уровень безопасности и формат данных, аналогичный применяемым при работе с ЕБС. Власти также утвердили максимальный размер вознаграждения, выплачиваемого сборщикам персональной биометрии за ее размещение в ЕБС.",https://www.cnews.ru/news/top/2021-08-18_vlasti_razrabotali_standarty
Легендарный производитель компьютерных аксессуаров сломя голову бежит из России,"В России закрылось представительство компании Genius – известного производителя мышек, клавиатур, колонок и другой компьютерной периферии. Компания пришла в страну еще в конце XX века. Genius может и вовсе покинуть россиский рынок на фоне стремительного падения ее продаж. ",https://www.cnews.ru/news/top/2021-08-18_legendarnyj_proizvoditel
«Ростелеком» приступает к новому этапу развития системы фотовидеофиксации на дорогах Башкортостана,До конца 2021 г. компания установит 500 стационарных комплексов фотовидеофиксации нарушения правил дорожного движения на автотрассах региона,https://www.cnews.ru/news/line/2021-08-18_rostelekom_pristupaet
