title,description,url«Яндекс» передумал покупать «Азбуку вкуса». Предполагаемая «экономия» — 20 миллиардов,"«Яндекс» вышел из переговоров по покупке сети супермаркетов «Азбука вкуса» для развития своего сервиса «Лавка». Сделка оценивалась приблизительно в 20 млрд руб. Одна из причин срыва переговоров – именно их финансовый аспект. По подсчетам экспертов, вывод «Лавки» во все города-миллионники России (сейчас он работает лишь в  пяти городах) обойдется «Яндексу» в 5 млрд. Сама же «Азбука вкуса» работает только в Москве, МО и Санкт-Петербурге. ",https://www.cnews.ru/news/top/2021-08-13_yandeks_s_treskom_provalil
Минцифры Калужской области и «Ред софт» заключили соглашение о сотрудничестве,Сотрудничество в рамках соглашения начнётся с перевода в ближайшее время автоматизированных рабочих мест сотрудников министерства на российскую операционной систему «Ред ОС»,https://www.cnews.ru/news/line/2021-08-13_mintsifry_kaluzhskoj_oblasti
Acer представила на российском рынке игровой 4K-монитор Nitro XV282KKV,"IPS-матрица, установленная в мониторе, имеет диагональ 28 дюймов и отличается широкими углами обзора и высокой яркостью до 400 нит",https://www.cnews.ru/news/line/2021-08-13_acer_predstavila_na_rossijskom
«Сбер» закрыл сделку по покупке приложения для бизнес-коммуникаций Jivo,Банк получил 100% компании,https://www.cnews.ru/news/line/2021-08-13_sber_zakryl_sdelku_po_pokupke
Amazon и Google спешно латают 10-летнюю брешь в своих DNS-платформах. Microsoft спокоен,Серьезная уязвимость в архитектуре DNS-провайдеров была раскрыта на Black Hat Security. Баг позволяет перехватывать часть входящего DNS-трафика.,https://www.cnews.ru/news/top/2021-08-13_amazon_i_google_speshno_latayut_10letnyuyu
Softline поставила ноутбуки для детей из многодетных малообеспеченных семей Красноярского края,Более 7 тыс. компьютеров уже используются школьниками этих семей для дистанционного и очного обучения,https://www.cnews.ru/news/line/2021-08-13_softline_postavila_noutbuki
Samsung начнет выпускать смартфоны из мусора,"Samsung инициировала программу повышения собственной экологичности. Она поставила перед собой ряд целей, которые нужно достичь не позднее 2025 г. Среди них – переход на использование вторичного сырья при производстве смартфонов и других устройств серии Galaxy, а также выпуск новых зарядных устройств с почти нулевым потреблением энергии в режиме ожидания. ",https://www.cnews.ru/news/top/2021-08-12_samsung_nachnet_vypuskat_smartfony
Тестирование мобильной ОС «Аврора» стало доступно всем желающим,«Открытая мобильная платформа» открыла возможность бета-тестирования ОС «Аврора» для всех желающих. Разработчик надеется таким образом ускорить развитие первой отечественной мобильной операционной системы и формирования ее экосистемы. Участники тестирования получат во временное пользование мобильное устройство с новой версией ОС «Аврора» и предустановленным набором стандартных приложений и возможностью установки приложений из магазина «Аврора Маркет».,https://www.cnews.ru/news/top/2021-08-12_testirovanie_mobilnoj_os
"Минцифры даст госорганам свободу в ИТ-развитии, чтобы оно не буксовало","Минцифры собирается разрешить госорганам самостоятельноменять свои программы цифровой трансформации. Ведомства без согласования смогутперераспределять в рамках программы сэкономленные средства по закупкам и остаткибюджетных средств с предыдущего года. Также госорганы смогут создать отдельную службу,на которую будет возложено организационное сопровождение цифровойтрансформации. ",https://www.cnews.ru/news/top/2021-08-12_mintsifry_lishaet_gosorgany
Продажи смартфонов в России рванули вверх благодаря iPhone 12,"По данным аналитического центра GS Grou, российский рынок смартфонов за первые шесть месяцев 2021 г. вырос на треть до 480 млрд руб., при этом в штучном выражении он увеличился только на 6% до 20,3 млн аппаратов. Xiaomi и Realme постепенно замещают дорогие модели Huawei, в то время как Ale собирает рекордную выручку премиального сегмента благодаря iPhone 12.",https://www.cnews.ru/news/top/2021-08-12_prodazhi_smartfonov_v_rossii
REG.RU запускает тестовый период для сервиса REG.Site,"Тестовый период в первую очередь подойдет тем, кто убеждён в том, что создать интернет-проект сложно",https://www.cnews.ru/news/line/2021-08-12_regru_zapuskaet_testovyj_period
Прорыв в законотворчестве. Монополии Apple и Google на рынке мобильного ПО грозит крах,"Американские демократы и республиканцы объединились, чтобы ограничить возможности крупных технологических компаний вроде Google и Ale в том, что касается магазинов мобильных приложений. Предложенный трио сенаторов законопроект, в частности, позволит разработчикам публиковать приложения для iOS и Android на альтернативных площадках и принимать оплату без отчислений техгигантам, не опасаясь репрессий со стороны последних. Ale и Google предложенные законодателями меры не одобряют.",https://www.cnews.ru/news/top/2021-08-12_vlasti_ssha_podumyvayut_zapretit
Райффайзенбанк обновил тарифы эквайринга для малого бизнеса,Спецтарифы для малого бизнеса в трех категориях,https://www.cnews.ru/news/line/2021-08-12_rajffajzenbank_obnovil_tarify
Клиенты Tele2 выбирают обслуживание в онлайн-каналах,В Tele2 отмечают рост популярности цифровых каналов обслуживания,https://www.cnews.ru/news/line/2021-08-12_klienty_tele2_vybirayut_obsluzhivanie
"Исследование SAS, KPGM и ACAMS: финорганизации ускорили внедрение ИИ и машинного обучения в AML-процессы",Под влиянием пандемии,https://www.cnews.ru/news/line/2021-08-12_issledovanie_saskpgm_i_acams_finorganizatsii
«Лаборатория Касперского» и ВТБ оценили объемы онлайн-мошенничества в первом полугодии 2021,Злоумышленники активно используют тему COVID-19 и вакцинации,https://www.cnews.ru/news/line/2021-08-12_laboratoriya_kasperskogo
МТС открыла инновационный центр в Нижнем Новгороде,Центр по инновациям и инвестициям MTS StartU Hub,https://www.cnews.ru/news/line/2021-08-12_mts_otkryla_innovatsionnyj
В Windows 11 против воли Microsoft появилось привычное «правильное» меню «Пуск»,"Для ОС Windows 11 появилась программа Start11, возвращающая меню «Пуск» в его исконное положение – в левый нижний угол экрана. Microsoft, не спросив пользователей, разместила его по центру и убрала из системы штатную возможность смены места его дислокации. Также Start11 позволяет кастомизировать «Пуск», дополнив его полезными пунктами меню и упростив с его помощью доступ ко многим компонентам системы.",https://www.cnews.ru/news/top/2021-08-12_v_windows_11_protiv_voli_microsoft
ВТБ: число клиентов среднего и малого бизнеса выросло почти на 20%,Самым активным месяцем стал апрель,https://www.cnews.ru/news/line/2021-08-12_vtb_chislo_klientov_srednego
«Тинькофф мобайл» запустился в Республике Алтай,«Тинькофф мобайл» начал официально работать на территории Республики Алтай,https://www.cnews.ru/news/line/2021-08-12_tinkoff_mobajl_zapustilsya
Выпускники столичной программы StartHub.Moscow привлекли 580 млн рублей инвестиций,Деньги компании планируют вложить в масштабирование бизнеса,https://www.cnews.ru/news/line/2021-08-12_vypuskniki_stolichnoj_programmy
Беспрецедентная щедрость. Xiaomi вернет деньги покупателям ее самого первого смартфона,"Xiaomi возместит всем владельцам своего самого первого смартфона Mi1 деньги, потраченные на его покупку. В сумме это около $57 млн. Mi1 был анонсирован ровно 10 лет назад, в августе 2011 г., и выделялся на фоне конкурентов заметно более низкой ценой при более современной электронике. В 2021 г. Xiaomi стала лидером на мировом рынке смартфонов. ",https://www.cnews.ru/news/top/2021-08-12_bespretsedentnyj_shagxiaomi
Платформа Yandex.Cloud прошла добровольную аттестацию на УЗ-1,Yandex.Cloud обеспечивает первый уровень защищенности персональных данных,https://www.cnews.ru/news/line/2021-08-12_platforma_yandexcloud_proshla
Orange Business Services и SES Networks ускорят цифровую трансформацию морского судоходства,Клиенты Orange Business Services в сфере морского торгового судоходства получат возможность расширить пропускную способность сетей с минимальными затратами,https://www.cnews.ru/news/line/2021-08-12_orange_business_services_i_ses_networks_uskoryat
Ntechlab научила камеры распознавать силуэты людей и автомобили,"Новый продукт Findface Multi получил функцию мультиобъектности – теперь нейросети распознают не только лица, но и силуэты людей, и автомобили, в том числе автомобильные номера",https://www.cnews.ru/news/line/2021-08-12_ntechlab_nauchila_kamery_raspoznavat
В России протестируют новый диапазон для 5G,"ГоспредприятиеНИИР получило разрешение на тестирование частот в новом диапазоне 6,7—6,8 ГГц.Данный диапазон может помочь решить проблемы с недоступностью в России частотдля 5G. Однако пока онне стандартизирован для сотовой связи на глобальном уровне.",https://www.cnews.ru/news/top/2021-08-11_v_rossii_protestiruyut_novyj
«Ростелеком» и Почта России подписали договор на услуги связи,Для самой большой в стране корпоративной сети передачи данных,https://www.cnews.ru/news/line/2021-08-12_rostelekom_i_pochta_rossii
Ростех и «Ростелеком» поставили в регионы более 400 криптобиокабин для оформления биометрических загранпаспортов,Устройства установлены в многофункциональных центрах,https://www.cnews.ru/news/line/2021-08-12_rosteh_i_rostelekom_postavili
Спутниковые решения РТКОММ обеспечили безопасность детских учреждений в Забайкалье,Услуги предоставлены лагерю «Березка» Акшинского района и Дульдургинскому детскому дому творчества,https://www.cnews.ru/news/line/2021-08-12_sputnikovye_resheniya_rtkomm
ВТБ оцифрует кадровый документооборот для зарплатных клиентов,Сервис HRlink будет интегрирован в мобильное приложение «ВТБ онлайн» до конца 2021 г.,https://www.cnews.ru/news/line/2021-08-12_vtb_otsifruet_kadrovyj_dokumentooborot
В WhatsApp появилась долгожданная сверхполезная функция. Ее реализация ужасна,"В WhatsA впервые за 12 лет его существования добавили функцию переноса чатов с Android на iOS и обратно. Правда работает новая опция исключительно со смартфонами Samsung, притом только с самыми дорогими и даже еще не поступившими в продажу. К тому же перенос данных возможен только по кабелю – синхронизировать мобильники «по воздуху» не получится. Разработчики обещают снять эти ограничения, но когда именно они сделают это – неизвестно. ",https://www.cnews.ru/news/top/2021-08-12_v_whatsapp_poyavilas_naipoleznejshaya
Обнаглевшие хакеры вербуют инсайдеров воззваниями на заблокированных ими корпоративных ПК,"В обоях Windows, которые LockBit размещает на атакованных машинах, содержится приглашение поработать «кротом» за миллионные вознаграждения. По-видимому, оно ориентировано на ИТ-консультантов.",https://www.cnews.ru/news/top/2021-08-06_obnaglevshie_hakery_verbuyut
Исследование: активность шифровальщиков в отношении госсектора выросла в 10 раз,"За первое полугодие 2021 г. отмечено больше атак сиспользованием шифровальщиков, чем за весь 2020 г., говорится в исследованиикомпании SonicWallstrong mso-bidi-font-weight:normal""""="""".strongstrong mso-bidi-font-weight:normal""""=""""strong mso-bidi-font-weight:normal""""=""""strong mso-bidi-font-weight:normal""""=""""brstrongstrongstrong",https://www.cnews.ru/news/top/2021-08-04_issledovanie_aktivnost
Google устроил грандиозную «зачистку» собственного магазина приложений для Android,"Фирменный магазин приложений Google для операционной системы Android пережил крупнейшую «чистку» с 2018 г. За первую половину 2021 г. Google Play лишился 115 тыс. приложений. Причина – ужесточение правил магазина, о котором корпорация объявила в апреле 2021 г.",https://www.cnews.ru/news/top/2021-08-11_google_ustroila_grandioznuyu
"Кому из ИИ-разработчиков надо дать денег, Минпромторгу расскажет компания, сбившая цену исследования в 10 раз","Исследование по выявлению наиболее перспективных для мировогорынка российских разработок «железа» для решения задач ИИ проведет молодаякомпания со скромной выручкой. Победитель тендера на исследование занизил ценуконтракта в десять раз и обошел не только фонд «Сколково», но и такиеизвестные институты как МГТУ им. Н. Э. Баумана, РАНХиГС, а также совместноепредприятие «ИКС холдинга» и «Ростеха».",https://www.cnews.ru/news/top/2021-08-11_perspektivnye_otrasli_ii
Конец скандально известной Avast. Ее покупают конкуренты за $8 млрд,"Разработчика антивируса Avast приберет к рукам компания NortonLifeLock, создатель антивирусного ПО Norton. Сумма сделки составит в пределах $8,6 млрд. После выполнения всех условий Avast перестанет существовать в качестве отдельной компании и будет объединена с NortonLifeLock. ",https://www.cnews.ru/news/top/2021-08-11_sozdateli_norton_antivirus_pokupayut
В России появятся тюнингованные iPhone 13 для верующих за полмиллиона,"Российский бренд люксовых смартфонов и аксессуаров Caviar представил коллекцию модифицированных iPhone 13 с храмами под стеклом. В коллекцию включены модели, посвященные православию, католицизму и исламу. Официальный анонс iPhone 13 ожидается не ранее чем через месяц.",https://www.cnews.ru/news/top/2021-08-11_v_rossii_vypushcheny_tyuningovannye
CNews приглашает на конференцию «ИКТ в госсекторе 2021» в сентябре,21 сентября  2021 года издание CNews проведет в Москвеконференцию «ИКТ в госсекторе 2021».,https://www.cnews.ru/news/top/2021-08-11_cnews_priglashaet_na_konferentsiyu
Xiaomi привезла в Россию бюджетные безрамочные смарт-ТВ. Видео,"Состоялась российская премьера новых смарт-ТВ Xiaomi линейки Mi TV P1. Из четырех моделей в Россию приехало пока только три (50-дюймовая не заявлена). Мировой показ серии прошел в мае 2021 г. Телевизоры стоят от 21 тыс. руб. до 48 тыс. руб. Самая доступная модель поставляется с HD-экраном, остальные – с полноценной поддержкой 4К. ",https://www.cnews.ru/news/top/2021-08-11_xiaomi_privezla_v_rossiyu_deshevye
Apple готовит масштабное обновление самого дешевого MacBook. Что в нем интересного,"Ale собирается выпустить обновленный MacBook Air в новых «радужных» цветах корпуса, как у iMac 2021. Лэптоп выйдет летом 2022 г. и будет построен на процессоре М1Х, который может оказаться трехнанометровым. Вместе с ним он получит новый экран miniLED и более строгий дизайн в стиле MacBook Pro.br",https://www.cnews.ru/news/top/2021-08-11_apple_gotovit_masshtabnyj_apgrejd
Зарплата экс-замминистра связи России в британском стартапе составила $830 тыс. за год,Бывший замминистра связи и первый гендиректортелекоммуникационной компании «Скартел» Денис Свердлов получает в созданном импроизводителе электрокаров Arrival зарплату в размере $830 тыс. вгод. Вместе со Свердловым в Arrival перешел ряд бывших сотрудниковМинкомсвязи и «Скартела».,https://www.cnews.ru/news/top/2021-08-10_ekszamministra_svyazi_poluchaet
Создатели российского репозитория «Сизиф» сообщили о выходе «Десятой платформы»,"Компания «Базальт СПО» сообщила о выпуске «Десятой платформы» (р10) ALT (Aronia) — новой ветки репозитория свободных программ «Сизиф» (Sisyhus). Она предназначена для разработки, тестирования, распространения, обновления и поддержки комплексных инфраструктурных и локальных решений всех уровней — от встроенных устройств до облаков. ",https://www.cnews.ru/news/top/2021-08-11_bazalt_spo_obnovil_linejku
Утвержден новый список российского ПО для предустановки на гаджеты. Приложений стало больше,"Российские власти утвердили новый перечень российских приложений, обязательных к предустановке на продающиеся в России устройства. Как и раньше, почти половина программ в нем созданы Mail.ru и «Яндексом», и теперь их стало еще больше. К тому же, теперь отечественный софт необходимо ставить на ПК компании Ale – раньше эти требования на них не распространялись. ",https://www.cnews.ru/news/top/2021-08-11_utverzhden_novyj_spisok_rossijskogo
