title,description,urlРадиолюбитель спас жизнь другу на расстоянии 800 километров,"    Радиолюбитель из США спас жизнь находившемуся на расстоянии 800 километров другу по хобби, который случайно набрал его номер. Оказалось, что у мужчины произошел инсульт, и он пытался обратиться за помощью, но плохо видел цифры на телефоне. Американец вызвал для звонившего врачей, и его удалось спасти.   ",https://lenta.ru/news/2021/08/18/radio/
Названа необходимая доза витамина C,"    Современные методы исследования позволили американским ученым пересмотреть выводы исследования, на основе которого ВОЗ был установлен дневной норматив потребления витамина C — выяснилось, что его необходимая доза более чем в два раза превышает установленную организацией.   ",https://lenta.ru/news/2021/08/18/needforc/
В Финляндии призвали правительство одобрить вакцину «Спутник V»,"    Правительство Финляндии должно одобрить российскую вакцину «Спутник V», если это возможно, заявил председатель регионального правительства финской области Южная Карелия Юкка Копра. Он добавил, что также призвал финские власти разрешить въезд в страну для привитых туристов из России.  ",https://lenta.ru/news/2021/08/18/finsputnik/
Девушка намочила наращенные волосы перед сном и испугалась своей внешности утром,"    Жительница Великобритании намочила перед сном наращенные в салоне красоты волосы, не высушила их феном и испугалась своей внешности на следующее утро. Девушке потребовалось 50 «изнурительных» часов, чтобы расчесать колтуны в спутанных волосах. Несмотря на ее усилия, прическа по-прежнему оставалась неаккуратной.   ",https://lenta.ru/news/2021/08/18/hair/
Подросток сломал позвоночник в Крыму из-за ошибки гида,"    В Крыму подросток, полетавший в паре с гидом на параплане, получил множественные травмы и ушибы тела из-за ошибки инструктора. На плато Ай-Петри, которое находится недалеко от города Ялты, 16-летняя жительница Алтайского края приобрела за восемь тысяч рублей услугу полета на параплане у гида, который не имел лицензии.  ",https://lenta.ru/news/2021/08/18/crimeachp/
ВОЗ заявила об обгоняющем антикоронавирусные меры штамме «дельта»,"    У здравоохранительных систем разных стран мира не хватает мощностей, чтобы эффективно противостоять «дельта»-мутации коронавируса. Об обгоняющем медицину штамме заявил на брифинге в Женеве генеральный директор Всемирной организации здравоохранения Тедрос Аданом Гебрейесус.  ",https://lenta.ru/news/2021/08/18/whodelta/
Литва обвинила Белоруссию в организации постановочных съемок с мигрантами,"    Вильнюс обнаружил в лесу съемочную площадку, где белорусские силовики записывают постановочные ролики об «избиении» мигрантов литовскими пограничниками. Власти смогли заснять этот процесс и пообещали обнародовать кадры в ближайшее время. С таким заявлением выступила глава МВД Литвы Агне Билотайте.  ",https://lenta.ru/news/2021/08/18/litva_bel/
Падение стены в Подмосковье из-за сильного ветра попало на видео,"    В подмосковном Подольске из-за сильного ветра рухнула каменная стена. Падение было зафиксировано камерами видеонаблюдения. В ролике видно улицу Комсомольская. Машины быстро проезжают по дороге, а затем неожиданно валится на землю красная каменная стена. При падении кирпичи относит к проезжей части.  ",https://lenta.ru/news/2021/08/18/padenie_veter/
В Афганистане возобновится работа миссии ООН,"    Миссия ООН по содействию Афганистану готовится возобновить работу в таких афганских городах, как Джелалабад, Кандагар и Кундуз, сообщили в посольстве РФ. Рейс российской авиакомпании Utair, прибывший из Москвы в Кабул, зафрахтован ООН для транспортировки новых сотрудников в Афганистан.   ",https://lenta.ru/news/2021/08/18/russiaun/
Россиян призвали смириться с пенсионным возрастом,"    Проректор Академии труда и социальных отношений, член экспертного совета при правительстве России Александр Сафонов призвал не мечтать о возвращении прежнего возраста выхода на пенсию и смириться с текущим положением дел. Таким образом он прокомментировал инициативу группы депутатов-коммунистов.  ",https://lenta.ru/news/2021/08/18/terpite/
Мишустин запретил иностранным судам заходить в три порта на Сахалине,"    Председатель федерального правительства Михаил Мишустин запретил иностранным судам заходить в три порта на российском острове Сахалин. Распоряжение, подписанное руоковдителем кабинета министров, распространяется на Александровск-Сахалинский, Москальво, а также на Поронайск.  ",https://lenta.ru/news/2021/08/18/porty/
Самая высокая гора Швеции оказалась под угрозой из-за глобального потепления,"    Южная вершина горы Кебнекайсе, которая считается самой высокой в Швеции, оказалась под угрозой из-за глобального потепления. За год ее высота уменьшилась на два метра, данные следуют из исследования ученых из Стокгольмского университета. В аналогичный период 2020-го высота горы достигала 2096 метров.  ",https://lenta.ru/news/2021/08/18/kebnekaise/
Джордж Сорос испугался репрессий Китая против собственных компаний,    Фонд американского инвестора Джорджа Сороса и другие крупные инвесторы из США начали активно продавать акции и отказываться от активов в Китае. Они боятся потерять деньги из-за государственных репрессий в отношении технологических компаний. Крупный инвестфонд ARK Invest больше не является держателем китайских акций.  ,https://lenta.ru/news/2021/08/18/fear/
Мария Бутина опровергла информацию о владении иностранными активами,"    Кандидат в Госдуму Мария Бутина ответила на заявление партии КПРФ об иностранных ценных бумагах. По ее словам, у нее действительно ранее имелись иностранные активы, однако перед выборами в Госдуму она от них избавилась. «Достойных способов добавить себе рейтинга у этой партии, видимо, не осталось», — отметила Бутина.  ",https://lenta.ru/news/2021/08/18/butiina/
Появились кадры сносящего все на своем пути в Подмосковье урагана,"    В подмосковных Котельниках и Дзержинском сносящий все на своем пути ураган попал на видео. На кадрах видно, как в Котельниках штормовой ветер сорвал утеплитель с дома, куски которого начали летать по двору. Рабочие, которые занимались строительными работами, успели покинуть люльки и укрыться.   ",https://lenta.ru/news/2021/08/18/uragan_moscow/
Украинский журналист раскритиковал репетицию военного парада из-за пробок,"    На Украине началась первая репетиция военного порода на центральных улицах Киева, из-за чего на дорогах образовались огромные пробки. Парализованное движение вызвало возмущение у многих украинцев, которые застряли в дороге на пути из центра города. К негодующим присоединился украинский журналист Тарас Березовец.   ",https://lenta.ru/news/2021/08/18/parad_ua/
Россия договорилась с Казахстаном о противодействии бытовому национализму,"    Министр иностранных дел России Сергей Лавров провел телефонные переговоры с казахстанским коллегой Мухтаром Тлеуберди. Главы ведомств обсудили ситуацию в Афганистане, обеспечение безопасности в Средней Азии, а также затронули вопросы двусторонних отношений, в частности — проявления бытового национализма.   ",https://lenta.ru/news/2021/08/18/chauvinism/
Еще один член сборной России по футболу покинул команду,"    Генеральный менеджер сборной России по футболу Евгений Савин покинул национальную команду. Савин захотел сосредоточится на работе в чемпионате России по футболу, где он является директором по проведению соревнований. Отмечается, что специалист не захотел совмещать две должности.   ",https://lenta.ru/news/2021/08/18/savin/
Женщина собралась замуж за сводного брата и расколола семью,"    23-летняя женщина рассказала, что ее сестра собралась замуж за их сводного брата и расколола семью. Анонимная пользовательница Reddit написала, что она и ее младшая сестра росли вместе со сводным братом, которому сейчас 25 лет. По словам рассказчицы, брат постоянно издевался над ней.  ",https://lenta.ru/news/2021/08/18/stepbrother/
Названо число закрывшихся из-за коронавируса российских компаний,    Пандемия коронавируса привела к закрытию менее трех процентов компаний в России. Эти данные озвучил уполномоченный при президенте России по защите прав предпринимателей Борис Титов. Однако последствия пандемии все еще сказываются на российском бизнесе. 60 процентов владельцев предприятий жалуются на слабый спрос.  ,https://lenta.ru/news/2021/08/18/coronzakr/
Школьник из Чебоксар вырастил 60-килограммовую тыкву,"    В Чебоксарах ученик восьмого класса Федор Матросов, занимающийся овощеводством три года, вырастил 60-килограммовую тыкву. Как рассказал школьник, такой урожай потребовал тщательной подготовки и ухода. В апреле он посадил семена сначала в горшок, а когда появился первый росток, перенес его в теплицу.   ",https://lenta.ru/news/2021/08/18/megapumpkin/
Десятилетний россиянин установил мировой рекорд по жиму штанги,"    Десятилетний россиянин Владислав Черепанов установил мировой рекорд по жиму штанги лежа. Ребенок из города Советска Кировской области побывал на соревнованиях в Москве, где за один подход смог поднять десятикилограммовую штангу 800 раз. Это уже второй рекорд мальчика, который до этого поднял штангу 703 раза.  ",https://lenta.ru/news/2021/08/18/shtanga/
В сети развеяли спорные мифы о женщинах,"    Пользователи Reddit перечислили мифы о женщинах, с которыми они сталкивались. Многие из них развеяли спорные убеждения. В одном из самых популярных комментариев, набравшем почти полторы тысячи лайков, пользователь сети под ником rizarice написал о том, что женщин считают излишне эмоциональными.   ",https://lenta.ru/news/2021/08/18/mif/
Президента Бразилии уличили в ложных данных о смертности от COVID-19,"    Президент Бразилии Жаир Болсонару опирался на ложные данные в своих заявлениях о смертности от COVID-19. К такому выводу пришла парламентская комиссия, которая в Конгрессе страны занимается расследованием дезинформации со стороны президента. Член счетной палаты Бразилии Александр Маркес создавал ложный документ.  ",https://lenta.ru/news/2021/08/18/fake_news/
В Москве задержали изнасиловавших и сбросивших девушку в канализацию россиян,"    В Москве и Московской области задержали трех мужчин, которые 20 лет назад изнасиловали, а затем убили девушку и сбросили тело в канализацию у торгового центра. По версии следствия, в январе 2001 года они заманили девушку на стройку, где изнасиловали ее и убили, а затем — избавились от тела.   ",https://lenta.ru/news/2021/08/18/msc/
Папа Римский сместил бразильского епископа из-за интимного видео,"    Папа Римский Франциск сместил епископа бразильского города Сан-Жозе-ду-Риу-Прету Томе Феррейру да Силва с его поста. Епископ сам подал прошение об отставке. Причиной стало видео, на котором полуобнаженный 60-летний священник звонит по видеосвязи другому мужчине, ведя с ним разговор интимного характера.   ",https://lenta.ru/news/2021/08/18/scandalpapa/
«Аэрофлот» приостановил полеты в Таиланд,"    Российская авиакомпания «Аэрофлот» приостановила рейсы в столицу Таиланда Бангкок до конца октября из-за ограничений на полеты над Афганистаном. Уточняется, что в связи с этим рейсы в столицу Таиланда будут отменены с 24 августа и предварительно до конца октября.  ",https://lenta.ru/news/2021/08/18/aef/
Продавщица раскрыла неприятную правду о работе в магазине подержанных вещей,"    Продавщица секонд-хенда раскрыла неприятные ситуации, с которыми она сталкивается во время работы. Блогерша Эш регулярно публикует видео, в которых рассказывает пользователям сети правду о своей деятельности. На данный момент на ее странице в соцсети TikTok подписаны 848 тысяч человек.  ",https://lenta.ru/news/2021/08/18/secondhand/
Паранджа в Афганистане подорожала в десять раз,"    Женщины Афганистана вынуждены проводить часы в очередях, чтобы купить паранджу. По их словам, после прихода к власти «Талибана» цены на этот вид одежды выросли в десять раз. Подорожание связано с высоким спросом. «Паранджа — редкость. У меня есть одна или две на трех женщин в семье», — заявила местная жительница.  ",https://lenta.ru/news/2021/08/18/talib_afgh_burqa/
Российские ученые нашли способ спасти мир от пластика,"    Найден новый способ спасти мир от пластика при помощи специальной добавки, эффективность которой протестировали воронежские ученые. Всего один процент вещества в составе сырья позволяет добиться того, чтобы полимерный материал начал разрушаться в природе после трех лет использования.  ",https://lenta.ru/news/2021/08/18/plastik/
Водитель автобуса в Турции вернул россиянке забытые деньги,"    Водитель автобуса в Турции вернул россиянке, которая едва не лишилась отпуска, забытые деньги. Отмечается, что 28-летняя российская туристка Лейла Гулиева прилетела в Турцию. Путешественница села в автобус, отправляющийся из аэропорта Бодрума в курортный город Милас, и затем девушка вышла на остановке у своего отеля.  ",https://lenta.ru/news/2021/08/18/fortanulo/
В России решили судить о «Талибане» по его действиям,"    Россия решила судить о движении «Талибан» в Афганистане по его действиям, сказал постоянный представитель РФ при ООН Василий Небензя. В ответ на вопрос, нужно ли Совету Безопасности ООН предпринимать больше действий по ситуации в Афганистане, Небензя сказал: «Посмотрим, как будут развиваться события».  ",https://lenta.ru/news/2021/08/18/nebenzya/
В Крыму начали принимать заявки на рибейты,"    В Крыму начали принимать заявки на рибейты — возмещение затрат, связанных с производством национальных фильмов на территории республики. Конкурс произойдет в рамках реализации Государственной программы Республики Крым «Развитие культуры, архивного дела и сохранение объектов культурного наследия Республики Крым».<br />  ",https://lenta.ru/news/2021/08/18/rebait/
Украине дадут миллиард долларов,"    В 2021 году Украина может получить от Международного валютного фонда (МВФ) около миллиарда долларов, сообщил Reuters заместитель главы Национального банка страны Сергей Николайчук в ответ на вопрос, сколько государство сможет получить по итогам работы миссии МВФ в сентябре.  ",https://lenta.ru/news/2021/08/18/imf/
У Африки отобрали вакцины от коронавируса,"    Африканские активисты заявили, что производитель Johnson & Johnson отбирает у жителей континента возможность вакцинироваться, экспортируя препараты от коронавируса из ЮАР. Медикаменты везут в Европу, где уже привито большинство населения. В Африке вакцинированы пока менее трех процентов жителей.  ",https://lenta.ru/news/2021/08/18/afrvac/
Найдены черные ящики разбившегося в Подмосковье Ил-112В,"    Черные ящики разбившегося в Подмосковье опытного образца новейшего российского военно-транспортного самолета Ил-112В, найдены.  на месте крушения борта обнаружены параметрический и речевой самописцы. «Они повреждены и обгорели, но, по предварительным данным, подлежат расшифровке», — рассказал источник.  ",https://lenta.ru/news/2021/08/18/naideni/
